Id,Label,title,Author,ASIN,SalesRank,Publisher,PublicationDate,ProductGroup,ProductTypeName,Language,ListPrice,FormattedPrice,CurrencyCode,TotalUsed,NumberOfPages,ISBN,image,HasReviews,seedNode,crawlDepth,Time Interval
n-b3182ad279a53a4ad4fc5c1b44b47838,How We Think: Digital Media and Contemporary Technogenesis by N. Katherine Hayles,How We Think: Digital Media and Contemporary Technogenesis,N. Katherine Hayles,0226321428,420671,University Of Chicago Press,2012-06-05,Book,ABIS_BOOK,English,2500,$25.00,USD,13,296,0226321428,http://ecx.images-amazon.com/images/I/51cq%2BKNuVOL._SL75_.jpg,false,false,1,"<[1.3388472E12, 1.3388472E12]>"
n-4a4725026639e5b052dda63aa73e243c,Debates in the Digital Humanities by Matthew K. Gold (ed),Debates in the Digital Humanities,Matthew K. Gold (ed),0816677956,82518,Univ Of Minnesota Press,2012-01-09,Book,ABIS_BOOK,English,3495,$34.95,USD,22,504,0816677956,http://ecx.images-amazon.com/images/I/51XTdUBPWEL._SL75_.jpg,false,,1,"<[1.3260636E12, 1.3260636E12]>"
n-ef14d5cb52a89ac38a6e4f0b21839d08,The Interface Effect by Alexander R. Galloway,The Interface Effect,Alexander R. Galloway,0745662536,118994,Polity,2013-01-22,Book,ABIS_BOOK,English,1995,$19.95,USD,6,200,0745662536,http://ecx.images-amazon.com/images/I/41KU4M1ifiL._SL75_.jpg,,,2,"<[1.3588092E12, 1.3588092E12]>"
n-84ec55497e8cdf9de304985fc0857f69,"Digital_Humanities by Anne Burdick, Johanna Drucker, Peter Lunenfeld, Todd Presner, Jeffrey Schnapp",Digital_Humanities,"Anne Burdick, Johanna Drucker, Peter Lunenfeld, Todd Presner, Jeffrey Schnapp",0262018470,43237,The MIT Press,2012-11-16,Book,ABIS_BOOK,English,2495,$24.95,USD,9,152,0262018470,http://ecx.images-amazon.com/images/I/41gjnnJ7xmL._SL75_.jpg,false,false,1,"<[1.3530204E12, 1.3530204E12]>"
n-824857fef57c56987ea62f89a5dc86d8,Understanding Digital Humanities by David M. Berry (ed),Understanding Digital Humanities,David M. Berry (ed),0230292658,249312,Palgrave Macmillan,2012-03-15,Book,ABIS_BOOK,English,3000,$30.00,USD,13,336,0230292658,http://ecx.images-amazon.com/images/I/51cS-ASy9aL._SL75_.jpg,,false,1,"<[1.331766E12, 1.331766E12]>"
n-9f7fb68b474da60d1b3111cea989f455,"Alien Phenomenology, or What It&quot;s Like to Be a Thing (Posthumanities) by Ian Bogost","Alien Phenomenology, or What It&quot;s Like to Be a Thing (Posthumanities)",Ian Bogost,0816678987,57073,Univ Of Minnesota Press,2012-03-19,Book,ABIS_BOOK,English,1995,$19.95,USD,18,168,0816678987,http://ecx.images-amazon.com/images/I/41mH8gESzOL._SL75_.jpg,false,,2,"<[1.3321116E12, 1.3321116E12]>"
n-9e36b1ba31361c3f77e476ad2589a55c,Book Was There: Reading in Electronic Times by Andrew Piper,Book Was There: Reading in Electronic Times,Andrew Piper,0226669785,59615,University Of Chicago Press,2012-10-18,Book,ABIS_BOOK,English,2250,$22.50,USD,16,208,0226669785,http://ecx.images-amazon.com/images/I/41LkwAWdYCL._SL75_.jpg,false,,2,"<[1.3505112E12, 1.3505112E12]>"
n-29135d27a490ef3c39dea7ec24f4eb72,Digital Memory and the Archive (Electronic Mediations) by Wolfgang Ernst,Digital Memory and the Archive (Electronic Mediations),Wolfgang Ernst,0816677670,65408,Univ Of Minnesota Press,2012-12-27,Book,ABIS_BOOK,English,2500,$25.00,USD,4,256,0816677670,http://ecx.images-amazon.com/images/I/61dQMGl7D5L._SL75_.jpg,,,2,"<[1.3565628E12, 1.3565628E12]>"
n-8e110c10f53ebfc0a08100e38421649c,"How We Became Posthuman: Virtual Bodies in Cybernetics, Literature, and Informatics by N. Katherine Hayles","How We Became Posthuman: Virtual Bodies in Cybernetics, Literature, and Informatics",N. Katherine Hayles,0226321460,28296,University Of Chicago Press,1999-02-15,Book,ABIS_BOOK,English,2250,$22.50,USD,25,364,0226321460,http://ecx.images-amazon.com/images/I/51KiFxiV32L._SL75_.jpg,false,,2,"<[9.190332E11, 9.190332E11]>"
n-bb534f0d741ab7e6809cc9db989faa3b,What is Media Archaeology by Jussi Parikka,What is Media Archaeology,Jussi Parikka,0745650260,162188,Polity,2012-06-11,Book,ABIS_BOOK,English,2495,$24.95,USD,14,200,0745650260,http://ecx.images-amazon.com/images/I/51Qlf7pN2%2BL._SL75_.jpg,false,,2,"<[1.3393656E12, 1.3393656E12]>"
n-0213e3189bd05fd8b07214467b6880ef,"Switching Codes: Thinking Through Digital Technology in the Humanities and the Arts by Thomas Bartscherer,Roderick Coover (eds)",Switching Codes: Thinking Through Digital Technology in the Humanities and the Arts,"Thomas Bartscherer,Roderick Coover (eds)",0226038319,868755,University Of Chicago Press,2011-05-30,Book,ABIS_BOOK,English,3000,$30.00,USD,24,448,0226038319,http://ecx.images-amazon.com/images/I/512D8H0XgML._SL75_.jpg,,,2,"<[1.3067064E12, 1.3067064E12]>"
n-b83ecdd7a1728e72ec04685f7e925ac0,Reading Machines: Toward an Algorithmic Criticism (Topics in the Digital Humanities) by Stephen Ramsay,Reading Machines: Toward an Algorithmic Criticism (Topics in the Digital Humanities),Stephen Ramsay,0252078209,81471,University of Illinois Press,2011-11-30,Book,ABIS_BOOK,English,2500,$25.00,USD,16,112,0252078209,http://ecx.images-amazon.com/images/I/51lhGV9CP8L._SL75_.jpg,false,false,1,"<[1.3226076E12, 1.3226076E12]>"
n-6b36d96e95cf935cfea1f45ff488c782,"Graphs, Maps, Trees: Abstract Models for Literary History by Franco Moretti","Graphs, Maps, Trees: Abstract Models for Literary History",Franco Moretti,1844671852,71802,Verso,2007-09-17,Book,ABIS_BOOK,English,1995,$19.95,USD,23,119,1844671852,http://ecx.images-amazon.com/images/I/51oaOpZio6L._SL75_.jpg,false,,1,"<[1.18998E12, 1.18998E12]>"
n-30dc0eb76109b0ac4e0fdfe2ea0cb7fd,"A Companion to Digital Humanities (Blackwell Companions to Literature and Culture) by Susan Schreibman,Ray Siemens,John Unsworth (eds)",A Companion to Digital Humanities (Blackwell Companions to Literature and Culture),"Susan Schreibman,Ray Siemens,John Unsworth (eds)",1405168064,879297,Wiley-Blackwell,2008-03-11,Book,ABIS_BOOK,English,5495,$54.95,USD,26,640,1405168064,http://ecx.images-amazon.com/images/I/41TU%2BOxxGVL._SL75_.jpg,,,2,"<[1.20519E12, 1.20519E12]>"
n-21a3670ac6ad6113ae3dac1c2c9a5e8e,"Planned Obsolescence: Publishing, Technology, and the Future of the Academy by Kathleen Fitzpatrick","Planned Obsolescence: Publishing, Technology, and the Future of the Academy",Kathleen Fitzpatrick,0814727883,126995,NYU Press,2011-11-01,Book,ABIS_BOOK,English,2300,$23.00,USD,9,256,0814727883,http://ecx.images-amazon.com/images/I/41uugiMAoTL._SL75_.jpg,false,,2,"<[1.320102E12, 1.320102E12]>"
n-98060958e701567f6042eb6e1ee6b6b9,Radiant Textuality: Literature after the World Wide Web by Jerome McGann,Radiant Textuality: Literature after the World Wide Web,Jerome McGann,140396436X,339009,Palgrave Macmillan,2004-01-03,Book,ABIS_BOOK,English,3400,$34.00,USD,18,288,140396436X,http://ecx.images-amazon.com/images/I/517DujXHPXL._SL75_.jpg,false,,2,"<[1.0730844E12, 1.0730844E12]>"
n-9a6bd100dc8277bcbe86de2b5c3b54c6,"Telesthesia: Communication, Culture & Class by McKenzie Wark","Telesthesia: Communication, Culture & Class",McKenzie Wark,0745653995,130198,Polity,2012-09-11,Book,ABIS_BOOK,English,1995,$19.95,USD,8,224,0745653995,http://ecx.images-amazon.com/images/I/31mCEET-FcL._SL75_.jpg,,,2,"<[1.3473144E12, 1.3473144E12]>"
n-0f78f132f619ea84f5a90b306010bbaa,"MP3: The Meaning of a Format (Sign, Storage, Transmission) by Jonathan Sterne","MP3: The Meaning of a Format (Sign, Storage, Transmission)",Jonathan Sterne,0822352877,85481,Duke University Press Books,2012-07-17,Book,ABIS_BOOK,English,2495,$24.95,USD,13,360,0822352877,http://ecx.images-amazon.com/images/I/51hDTaSdlQL._SL75_.jpg,false,,2,"<[1.342476E12, 1.342476E12]>"
n-dd006d9834236e6266d3c1104f6561a1,Coding Freedom: The Ethics and Aesthetics of Hacking by E. Gabriella Coleman,Coding Freedom: The Ethics and Aesthetics of Hacking,E. Gabriella Coleman,0691144613,11442,Princeton University Press,2012-11-12,Book,ABIS_BOOK,English,2495,$24.95,USD,5,264,0691144613,http://ecx.images-amazon.com/images/I/41OvoAd0XNL._SL75_.jpg,false,,2,"<[1.3526748E12, 1.3526748E12]>"
n-46ed18de05b1a8818a8cd7c4c64dd1c5,Gaming: Essays On Algorithmic Culture (Electronic Mediations) by Alexander R. Galloway,Gaming: Essays On Algorithmic Culture (Electronic Mediations),Alexander R. Galloway,0816648514,190544,Univ Of Minnesota Press,2006-05-27,Book,ABIS_BOOK,English,1795,$17.95,USD,25,160,0816648514,http://ecx.images-amazon.com/images/I/418Z698NB5L._SL75_.jpg,false,,2,"<[1.1486808E12, 1.1486808E12]>"
n-b808566e7beca578290013466bc829e5,"Speaking Code: Coding as Aesthetic and Political Expression (Software Studies) by Geoff Cox, Alex McLean",Speaking Code: Coding as Aesthetic and Political Expression (Software Studies),"Geoff Cox, Alex McLean",0262018365,635609,The MIT Press,2012-11-09,Book,ABIS_BOOK,English,3000,$30.00,USD,9,168,0262018365,http://ecx.images-amazon.com/images/I/51CTGJhGEVL._SL75_.jpg,,,2,"<[1.3524156E12, 1.3524156E12]>"
n-beaa20e417dd228c02bb2aed4bb1b29c,Gilbert Simondon and the Philosophy of the Transindividual (Technologies of Lived Abstraction) by Muriel Combes,Gilbert Simondon and the Philosophy of the Transindividual (Technologies of Lived Abstraction),Muriel Combes,0262018187,459603,The MIT Press,2012-10-12,Book,ABIS_BOOK,English,2700,$27.00,USD,11,144,0262018187,http://ecx.images-amazon.com/images/I/41FfLJxOrJL._SL75_.jpg,,,2,"<[1.3499928E12, 1.3499928E12]>"
n-7b06dbe09de2dda81f36535a06238eb6,Digital Labor: The Internet as Playground and Factory by Trebor Scholz (ed),Digital Labor: The Internet as Playground and Factory,Trebor Scholz (ed),0415896959,134911,Routledge,2012-09-21,Book,ABIS_BOOK,English,3795,$37.95,USD,12,272,0415896959,http://ecx.images-amazon.com/images/I/41V1%2BPYnkNL._SL75_.jpg,false,,2,"<[1.3481784E12, 1.3481784E12]>"
n-5fad4b58530069c71a52db3843e0962d,Networks of Outrage and Hope: Social Movements in the Internet Age by Manuel Castells,Networks of Outrage and Hope: Social Movements in the Internet Age,Manuel Castells,0745662854,4654,Polity,2012-09-04,Book,ABIS_BOOK,English,1495,$14.95,USD,7,200,0745662854,http://ecx.images-amazon.com/images/I/51SK7ZSSbCL._SL75_.jpg,false,,2,"<[1.3467096E12, 1.3467096E12]>"
n-f336b31509971a49ffec6901537a6f68,"10 PRINT CHR$(205.5+RND(1)); : GOTO 10 (Software Studies) by Nick Montfort, Patsy Baudoin, John Bell, Ian Bogost, Jeremy Douglass, Mark C. Marino, Michael Mateas, Casey Reas, Mark Sample, Noah Vawter",10 PRINT CHR$(205.5+RND(1)); : GOTO 10 (Software Studies),"Nick Montfort, Patsy Baudoin, John Bell, Ian Bogost, Jeremy Douglass, Mark C. Marino, Michael Mateas, Casey Reas, Mark Sample, Noah Vawter",0262018462,70099,The MIT Press,2012-11-16,Book,ABIS_BOOK,English,3000,$30.00,USD,12,328,0262018462,http://ecx.images-amazon.com/images/I/61whD8baZDL._SL75_.jpg,false,,2,"<[1.3530204E12, 1.3530204E12]>"
n-c9834eb323f16ae3237b0551dfb23808,Electronic Literature: New Horizons for the Literary (WARD PHILLIPS LECTUR) by N. Katherine Hayles,Electronic Literature: New Horizons for the Literary (WARD PHILLIPS LECTUR),N. Katherine Hayles,0268030855,156546,University of Notre Dame Press,2008-03-01,Book,ABIS_BOOK,English,2000,$20.00,USD,37,192,0268030855,http://ecx.images-amazon.com/images/I/41b4di6FvLL._SL75_.jpg,false,,2,"<[1.204326E12, 1.204326E12]>"
n-f4235a47d131fdf30131812e715f6c81,The Democracy of Objects by Levi R. Bryant,The Democracy of Objects,Levi R. Bryant,1607852047,98235,"MPublishing, University of Michigan Library",2011-10-31,Book,ABIS_BOOK,English,2399,$23.99,USD,,316,1607852047,http://ecx.images-amazon.com/images/I/41pO1gBo4WL._SL75_.jpg,false,,2,"<[1.3200156E12, 1.3200156E12]>"
n-59a1a586f2629258a35fc0c101152443,The Quadruple Object by Graham Harman,The Quadruple Object,Graham Harman,1846947006,157328,Zero Books,2011-07-16,Book,ABIS_BOOK,English,1695,$16.95,USD,9,157,1846947006,http://ecx.images-amazon.com/images/I/41xdRisoKQL._SL75_.jpg,false,,2,"<[1.3107672E12, 1.3107672E12]>"
n-631729a006c499ef3be2997431989aeb,Vibrant Matter: A Political Ecology of Things (a John Hope Franklin Center Book) by Jane Bennett,Vibrant Matter: A Political Ecology of Things (a John Hope Franklin Center Book),Jane Bennett,0822346338,37965,Duke University Press Books,2010-01-04,Book,ABIS_BOOK,English,2195,$21.95,USD,17,200,0822346338,http://ecx.images-amazon.com/images/I/41tnu-MyFlL._SL75_.jpg,false,,2,"<[1.2625596E12, 1.2625596E12]>"
n-96e80935aa23dd6437246e2a7db792dc,After Finitude: An Essay on the Necessity of Contingency by Quentin Meillassoux,After Finitude: An Essay on the Necessity of Contingency,Quentin Meillassoux,1441173838,72701,Continuum,2010-01-05,Book,ABIS_BOOK,English,1995,$19.95,USD,24,160,1441173838,http://ecx.images-amazon.com/images/I/51m6FNHPwqL._SL75_.jpg,false,,2,"<[1.262646E12, 1.262646E12]>"
n-75a7689e4b581975bbea93fd10b34439,"New Materialisms: Ontology, Agency, and Politics by Diana Coole,Samantha Frost (eds)","New Materialisms: Ontology, Agency, and Politics","Diana Coole,Samantha Frost (eds)",0822347725,195917,Duke University Press Books,2010-09-09,Book,ABIS_BOOK,English,2495,$24.95,USD,10,352,0822347725,http://ecx.images-amazon.com/images/I/51Np6lje%2ByL._SL75_.jpg,,,2,"<[1.2839832E12, 1.2839832E12]>"
n-1c72060e12835f4ce5eadfeb8c06e70b,"Vampyroteuthis Infernalis: A Treatise, with a Report by the Institut Scientifique de Recherche Paranaturaliste (Posthumanities) by Vilem Flusser, Louis Bec","Vampyroteuthis Infernalis: A Treatise, with a Report by the Institut Scientifique de Recherche Paranaturaliste (Posthumanities)","Vilem Flusser, Louis Bec",0816678227,82870,Univ Of Minnesota Press,2012-09-06,Book,ABIS_BOOK,English,1950,$19.50,USD,12,112,0816678227,http://ecx.images-amazon.com/images/I/51DDsxFTRpL._SL75_.jpg,,,2,"<[1.3468824E12, 1.3468824E12]>"
n-6e54ed3b54a56c596b59c98069e11a23,We Have Never Been Modern by Bruno Latour,We Have Never Been Modern,Bruno Latour,0674948394,29870,Harvard University Press,1993-10-15,Book,ABIS_BOOK,English,2700,$27.00,USD,27,168,0674948394,http://ecx.images-amazon.com/images/I/41V330QQZTL._SL75_.jpg,false,,2,"<[7.506396E11, 7.506396E11]>"
n-e0224475f6ebe76041f45575d29bccca,How to Do Things with Videogames (Electronic Mediations) by Ian Bogost,How to Do Things with Videogames (Electronic Mediations),Ian Bogost,081667647X,30107,Univ Of Minnesota Press,2011-08-05,Book,ABIS_BOOK,English,1895,$18.95,USD,26,192,081667647X,http://ecx.images-amazon.com/images/I/51BMqdlxCtL._SL75_.jpg,false,,2,"<[1.3124952E12, 1.3124952E12]>"
n-c4a7d8384f746b025b0301e090b12769,Weird Realism: Lovecraft and Philosophy by Graham Harman,Weird Realism: Lovecraft and Philosophy,Graham Harman,1780992521,93504,Zero Books,2012-09-16,Book,ABIS_BOOK,English,2495,$24.95,USD,12,277,1780992521,http://ecx.images-amazon.com/images/I/41MrJhPbCSL._SL75_.jpg,false,,2,"<[1.3477464E12, 1.3477464E12]>"
n-172e3bbf80edbe1e84a9a0c3d2b85a39,The Missing Ink: The Lost Art of Handwriting by Philip Hensher,The Missing Ink: The Lost Art of Handwriting,Philip Hensher,0865478937,90514,Faber & Faber,2012-11-27,Book,ABIS_BOOK,English,2600,$26.00,USD,17,288,0865478937,http://ecx.images-amazon.com/images/I/617Rp5CjhqL._SL75_.jpg,false,,2,"<[1.3539708E12, 1.3539708E12]>"
n-c3733e6e945bb7378ca06e6b3a7f7192,Dreaming in Books: The Making of the Bibliographic Imagination in the Romantic Age by Andrew Piper,Dreaming in Books: The Making of the Bibliographic Imagination in the Romantic Age,Andrew Piper,0226669726,348337,University Of Chicago Press,2009-08-01,Book,ABIS_BOOK,English,3500,$35.00,USD,13,320,0226669726,http://ecx.images-amazon.com/images/I/41AGPh10tLL._SL75_.jpg,,,2,"<[1.2490776E12, 1.2490776E12]>"
n-e17650c8ee2ba66e66cf07f67bc3079a,The Demon of Writing: Powers and Failures of Paperwork by Ben Kafka,The Demon of Writing: Powers and Failures of Paperwork,Ben Kafka,1935408267,74413,Zone Books,2012-11-02,Book,ABIS_BOOK,English,2895,$28.95,USD,12,208,1935408267,http://ecx.images-amazon.com/images/I/51BrxYDrnTL._SL75_.jpg,false,,2,"<[1.3518108E12, 1.3518108E12]>"
n-1adb91ae2462d5ad1e5b3b016124cade,One for the Books by Joe Queenan,One for the Books,Joe Queenan,0670025828,25063,Viking Adult,2012-10-25,Book,ABIS_BOOK,English,2495,$24.95,USD,16,256,0670025828,http://ecx.images-amazon.com/images/I/51aJbD9qctL._SL75_.jpg,false,,2,"<[1.351116E12, 1.351116E12]>"
n-84cc6605918a6aa05bde9b3766a84209,Monsieur Proust&quot;s Library by Anka Muhlstein,Monsieur Proust&quot;s Library,Anka Muhlstein,1590515668,13542,Other Press,2012-11-06,Book,ABIS_BOOK,English,1995,$19.95,USD,23,160,1590515668,http://ecx.images-amazon.com/images/I/51MybC-QriL._SL75_.jpg,false,,2,"<[1.3521564E12, 1.3521564E12]>"
n-4406871ccdf10a29d78e360109b3e2c8,Mr. Penumbra&quot;s 24-Hour Bookstore: A Novel by Robin Sloan,Mr. Penumbra&quot;s 24-Hour Bookstore: A Novel,Robin Sloan,0374214913,1093,"Farrar, Straus and Giroux",2012-10-02,Book,ABIS_BOOK,English,2500,$25.00,USD,12,304,0374214913,http://ecx.images-amazon.com/images/I/51Py-rP96UL._SL75_.jpg,false,,2,"<[1.3491288E12, 1.3491288E12]>"
n-534be0bb7e30cf926bc13c3e576734b9,The Shallows: What the Internet Is Doing to Our Brains by Nicholas Carr,The Shallows: What the Internet Is Doing to Our Brains,Nicholas Carr,0393339750,492,W. W. Norton & Company,2011-06-06,Book,ABIS_BOOK,English,1595,$15.95,USD,60,280,0393339750,http://ecx.images-amazon.com/images/I/4197RTFGLFL._SL75_.jpg,false,,2,"<[1.3073112E12, 1.3073112E12]>"
n-a7534e66d39e606a5fcdff6919153d8d,"My Bookstore: Writers Celebrate Their Favorite Places to Browse, Read, and Shop by Ronald Rice (ed)","My Bookstore: Writers Celebrate Their Favorite Places to Browse, Read, and Shop",Ronald Rice (ed),1579129102,39428,Black Dog & Leventhal Publishers,2012-11-13,Book,ABIS_BOOK,English,2395,$23.95,USD,20,384,1579129102,http://ecx.images-amazon.com/images/I/51Xfhy3yQDL._SL75_.jpg,false,,2,"<[1.3527612E12, 1.3527612E12]>"
n-d0be8a1ca2e6d921b144bcf4149497bb,Paper: An Elegy by Ian Sansom,Paper: An Elegy,Ian Sansom,0007480261,415591,Fourth Estate,2012-10-25,Book,ABIS_BOOK,English,,,,6,192,0007480261,http://ecx.images-amazon.com/images/I/519KFTyTevL._SL75_.jpg,,,2,"<[1.351116E12, 1.351116E12]>"
n-491fb55a013173c7e22771908928c6bd,Post-History (Univocal) by Vilem Flusser,Post-History (Univocal),Vilem Flusser,1937561097,665496,Univocal Publishing,2013-02-01,Book,ABIS_BOOK,English,2495,$24.95,USD,,170,1937561097,http://ecx.images-amazon.com/images/I/31oLsLABt4L._SL75_.jpg,,,2,"<[1.3596732E12, 1.3596732E12]>"
n-2d7840e8af89cdec6e764378e2421793,"Our Aesthetic Categories: Zany, Cute, Interesting by Sianne Ngai","Our Aesthetic Categories: Zany, Cute, Interesting",Sianne Ngai,0674046587,94396,Harvard University Press,2012-10-15,Book,ABIS_BOOK,English,3995,$39.95,USD,11,344,0674046587,http://ecx.images-amazon.com/images/I/51JyXEbn9OL._SL75_.jpg,,,2,"<[1.350252E12, 1.350252E12]>"
n-1552198d18e65abb7d3585a515930a32,Two Lessons on Animal and Man (Univocal) by Gilbert Simondon,Two Lessons on Animal and Man (Univocal),Gilbert Simondon,1937561011,257236,Univocal Publishing,2012-06-13,Book,ABIS_BOOK,English,1995,$19.95,USD,7,92,1937561011,http://ecx.images-amazon.com/images/I/41wlZRIU8DL._SL75_.jpg,,,2,"<[1.3395384E12, 1.3395384E12]>"
n-e18d67a362cfef9fd7c902c8e2581f78,What Is Posthumanism? (Posthumanities) by Cary Wolfe,What Is Posthumanism? (Posthumanities),Cary Wolfe,0816666156,232594,Univ Of Minnesota Press,2009-12-31,Book,ABIS_BOOK,English,2495,$24.95,USD,25,400,0816666156,http://ecx.images-amazon.com/images/I/51WDNyQlKgL._SL75_.jpg,false,,2,"<[1.262214E12, 1.262214E12]>"
n-117a236cc10b11d8e6f7f9129571886c,When Species Meet (Posthumanities) by Donna J. Haraway,When Species Meet (Posthumanities),Donna J. Haraway,0816650462,72575,Univ Of Minnesota Press,2007-11-26,Book,ABIS_BOOK,English,2495,$24.95,USD,32,360,0816650462,http://ecx.images-amazon.com/images/I/31EEXoV6P%2BL._SL75_.jpg,false,,2,"<[1.1960316E12, 1.1960316E12]>"
n-3cafb6e34f78d9f821db5ef6fadab766,The Animal That Therefore I Am (Perspectives in Continental Philosophy) by Jacques Derrida,The Animal That Therefore I Am (Perspectives in Continental Philosophy),Jacques Derrida,082322791X,93817,Fordham University Press,2008-04-15,Book,ABIS_BOOK,English,2300,$23.00,USD,20,192,082322791X,http://ecx.images-amazon.com/images/I/31SzENz9J7L._SL75_.jpg,false,,2,"<[1.2082104E12, 1.2082104E12]>"
n-1d297466cfe78d6f4bd9a4817dcc27e0,"Simians, Cyborgs, and Women: The Reinvention of Nature by Donna J. Haraway","Simians, Cyborgs, and Women: The Reinvention of Nature",Donna J. Haraway,0415903874,158467,Routledge,1990-12-12,Book,ABIS_BOOK,English,4495,$44.95,USD,30,312,0415903874,http://ecx.images-amazon.com/images/I/41u7BDJxssL._SL75_.jpg,false,,2,"<[6.609564E11, 6.609564E11]>"
n-6b8c36407262b6c89ec921ef140ee98b,The Open: Man and Animal by Giorgio Agamben,The Open: Man and Animal,Giorgio Agamben,0804747385,201642,Stanford University Press,2003-10-23,Book,ABIS_BOOK,English,2095,$20.95,USD,26,120,0804747385,http://ecx.images-amazon.com/images/I/41nvyezn5qL._SL75_.jpg,false,,2,"<[1.06686E12, 1.06686E12]>"
n-a0c607cad963149667cfb0cb95779bd6,"Discourse Networks, 1800/1900 by Friedrich A. Kittler, Michael Metteer","Discourse Networks, 1800/1900","Friedrich A. Kittler, Michael Metteer",0804720991,69780,Stanford University Press,1992-07-01,Book,ABIS_BOOK,English,3295,$32.95,USD,21,496,0804720991,http://ecx.images-amazon.com/images/I/416KR536QYL._SL75_.jpg,false,,2,"<[7.099416E11, 7.099416E11]>"
n-6a6516d7acedf463d1ddcc48eeb927d6,"Media Archæology: Approaches, Applications, and Implications by Erkki Huhtamo (ed)","Media Archæology: Approaches, Applications, and Implications",Erkki Huhtamo (ed),0520262743,494233,University of California Press,2011-06-12,Book,ABIS_BOOK,English,2695,$26.95,USD,15,368,0520262743,http://ecx.images-amazon.com/images/I/51MDmISfFSL._SL75_.jpg,false,,2,"<[1.3078296E12, 1.3078296E12]>"
n-5f775a35f547fa4e915ca69243812302,How Buildings Learn: What Happens After They&quot;re Built by Stewart Brand,How Buildings Learn: What Happens After They&quot;re Built,Stewart Brand,0140139966,46031,Penguin Books,1995-10-01,Book,ABIS_BOOK,English,3500,$35.00,USD,51,252,0140139966,http://ecx.images-amazon.com/images/I/51s1YrnJtrL._SL75_.jpg,false,,2,"<[8.12502E11, 8.12502E11]>"
n-bc17c28043e4c14ff2176dd6bcc9ced5,Stuff by Daniel Miller,Stuff,Daniel Miller,0745644244,163153,Polity,2009-12-02,Book,ABIS_BOOK,English,2295,$22.95,USD,16,220,0745644244,http://ecx.images-amazon.com/images/I/417dC-J121L._SL75_.jpg,false,,2,"<[1.2597084E12, 1.2597084E12]>"
n-5f600496511f2ce457439e06ef383174,"The Lives They Left Behind: Suitcases from a State Hospital Attic by Darby Penney, Peter Stastny",The Lives They Left Behind: Suitcases from a State Hospital Attic,"Darby Penney, Peter Stastny",1934137146,35438,Bellevue Literary Press,2009-01-01,Book,ABIS_BOOK,English,1495,$14.95,USD,30,205,1934137146,http://ecx.images-amazon.com/images/I/51GDtpG7T6L._SL75_.jpg,false,,2,"<[1.2307644E12, 1.2307644E12]>"
n-a9a741751371e49b8d26f2e066c677f4,"Digital Art and Meaning: Reading Kinetic Poetry, Text Machines, Mapping Art, and Interactive Installations (Electronic Mediations) by Roberto Simanowski","Digital Art and Meaning: Reading Kinetic Poetry, Text Machines, Mapping Art, and Interactive Installations (Electronic Mediations)",Roberto Simanowski,0816667381,355287,Univ Of Minnesota Press,2011-05-20,Book,ABIS_BOOK,English,2500,$25.00,USD,9,328,0816667381,http://ecx.images-amazon.com/images/I/41eev6RmkjL._SL75_.jpg,,,2,"<[1.3058424E12, 1.3058424E12]>"
n-3c8cf7d145e431e158cab8169244d77b,The Language of New Media (Leonardo Books) by Lev Manovich,The Language of New Media (Leonardo Books),Lev Manovich,0262632551,29779,The MIT Press,2002-03-07,Book,ABIS_BOOK,English,2995,$29.95,USD,52,400,0262632551,http://ecx.images-amazon.com/images/I/51E8CRYAMNL._SL75_.jpg,false,,2,"<[1.0154556E12, 1.0154556E12]>"
n-336a0bc75edd09fb5cdf2f35ffe4dc38,"Form+Code in Design, Art, and Architecture (Design Briefs) by Casey Reas, Chandler McWilliams","Form+Code in Design, Art, and Architecture (Design Briefs)","Casey Reas, Chandler McWilliams",1568989377,67950,Princeton Architectural Press,2010-09-01,Book,ABIS_BOOK,English,2495,$24.95,USD,30,176,1568989377,http://ecx.images-amazon.com/images/I/511-bsH1xaL._SL75_.jpg,false,,2,"<[1.283292E12, 1.283292E12]>"
n-e60554e6c164db0ddcf338298d14a83a,Mechanisms: New Media and the Forensic Imagination by Matthew G. Kirschenbaum,Mechanisms: New Media and the Forensic Imagination,Matthew G. Kirschenbaum,026251740X,445342,The MIT Press,2012-01-06,Book,ABIS_BOOK,English,1900,$19.00,USD,19,314,026251740X,http://ecx.images-amazon.com/images/I/51EM%2B6ux8dL._SL75_.jpg,false,,2,"<[1.3258044E12, 1.3258044E12]>"
n-bd2389e5de6bb94967a321e3708ce419,"Digital History: A Guide to Gathering, Preserving, and Presenting the Past on the Web by Daniel Cohen, Roy Rosenzweig","Digital History: A Guide to Gathering, Preserving, and Presenting the Past on the Web","Daniel Cohen, Roy Rosenzweig",0812219236,579753,University of Pennsylvania Press,2005-08-30,Book,ABIS_BOOK,English,2995,$29.95,USD,34,328,0812219236,http://ecx.images-amazon.com/images/I/517H0Y8KRNL._SL75_.jpg,false,,2,"<[1.1253528E12, 1.1253528E12]>"
n-7c99f484c97e160ecc6a8a4e8cc9f331,Atlas of the European Novel 1800-1900 by Franco Moretti,Atlas of the European Novel 1800-1900,Franco Moretti,1859842240,303031,Verso,1999-09-17,Book,ABIS_BOOK,English,2495,$24.95,USD,29,192,1859842240,http://ecx.images-amazon.com/images/I/51dOGwi0jAL._SL75_.jpg,false,,2,"<[9.375192E11, 9.375192E11]>"
n-1103edeee4b3351ecdc9dfac84dc55f2,The World Republic of Letters (Convergences: Inventories of the Present) by Pascale Casanova,The World Republic of Letters (Convergences: Inventories of the Present),Pascale Casanova,0674010213,428219,Harvard University Press,2007-04-30,Book,ABIS_BOOK,English,2350,$23.50,USD,19,440,0674010213,http://ecx.images-amazon.com/images/I/41uQB9VtepL._SL75_.jpg,false,,2,"<[1.177884E12, 1.177884E12]>"
